[
  {
    "batch_id": "SUB_BATCH_001",
    "ceremony_id": "CEREMONY_001",
    "submitting_label_id": "LBL_COLUMBIA_RECORDS_01",
    "submission_timestamp": "1959-10-15T18:00:00Z",
    "total_entries_count": 25,
    "entry_fee_total_usd": 2500.0,
    "compliance_officer_name": "Label Submissions Director 1",
    "first_round_accepted_count": 24,
    "disqualified_entries_count": 1,
    "payment_reconciliation_hash": "PAY_HASH_88000"
  },
  {
    "batch_id": "SUB_BATCH_002",
    "ceremony_id": "CEREMONY_002",
    "submitting_label_id": "LBL_RCA_VICTOR_02",
    "submission_timestamp": "1960-10-15T18:00:00Z",
    "total_entries_count": 27,
    "entry_fee_total_usd": 2700.0,
    "compliance_officer_name": "Label Submissions Director 2",
    "first_round_accepted_count": 26,
    "disqualified_entries_count": 1,
    "payment_reconciliation_hash": "PAY_HASH_88001"
  },
  {
    "batch_id": "SUB_BATCH_003",
    "ceremony_id": "CEREMONY_003",
    "submitting_label_id": "LBL_ATLANTIC_RECORDS_03",
    "submission_timestamp": "1961-10-15T18:00:00Z",
    "total_entries_count": 29,
    "entry_fee_total_usd": 2900.0,
    "compliance_officer_name": "Label Submissions Director 3",
    "first_round_accepted_count": 28,
    "disqualified_entries_count": 1,
    "payment_reconciliation_hash": "PAY_HASH_88002"
  },
  {
    "batch_id": "SUB_BATCH_004",
    "ceremony_id": "CEREMONY_004",
    "submitting_label_id": "LBL_MOTOWN_RECORDS_04",
    "submission_timestamp": "1962-10-15T18:00:00Z",
    "total_entries_count": 31,
    "entry_fee_total_usd": 3100.0,
    "compliance_officer_name": "Label Submissions Director 4",
    "first_round_accepted_count": 30,
    "disqualified_entries_count": 1,
    "payment_reconciliation_hash": "PAY_HASH_88003"
  },
  {
    "batch_id": "SUB_BATCH_005",
    "ceremony_id": "CEREMONY_005",
    "submitting_label_id": "LBL_CAPITOL_RECORDS_05",
    "submission_timestamp": "1963-10-15T18:00:00Z",
    "total_entries_count": 33,
    "entry_fee_total_usd": 3300.0,
    "compliance_officer_name": "Label Submissions Director 5",
    "first_round_accepted_count": 32,
    "disqualified_entries_count": 1,
    "payment_reconciliation_hash": "PAY_HASH_88004"
  },
  {
    "batch_id": "SUB_BATCH_006",
    "ceremony_id": "CEREMONY_006",
    "submitting_label_id": "LBL_EPIC_RECORDS_06",
    "submission_timestamp": "1964-10-15T18:00:00Z",
    "total_entries_count": 35,
    "entry_fee_total_usd": 3500.0,
    "compliance_officer_name": "Label Submissions Director 6",
    "first_round_accepted_count": 34,
    "disqualified_entries_count": 1,
    "payment_reconciliation_hash": "PAY_HASH_88005"
  },
  {
    "batch_id": "SUB_BATCH_007",
    "ceremony_id": "CEREMONY_007",
    "submitting_label_id": "LBL_INTERSCOPE_RECORDS_07",
    "submission_timestamp": "1965-10-15T18:00:00Z",
    "total_entries_count": 37,
    "entry_fee_total_usd": 3700.0,
    "compliance_officer_name": "Label Submissions Director 7",
    "first_round_accepted_count": 36,
    "disqualified_entries_count": 1,
    "payment_reconciliation_hash": "PAY_HASH_88006"
  },
  {
    "batch_id": "SUB_BATCH_008",
    "ceremony_id": "CEREMONY_008",
    "submitting_label_id": "LBL_DEF_JAM_RECORDINGS_08",
    "submission_timestamp": "1966-10-15T18:00:00Z",
    "total_entries_count": 39,
    "entry_fee_total_usd": 3900.0,
    "compliance_officer_name": "Label Submissions Director 8",
    "first_round_accepted_count": 38,
    "disqualified_entries_count": 1,
    "payment_reconciliation_hash": "PAY_HASH_88007"
  },
  {
    "batch_id": "SUB_BATCH_009",
    "ceremony_id": "CEREMONY_009",
    "submitting_label_id": "LBL_BLUE_NOTE_RECORDS_09",
    "submission_timestamp": "1967-10-15T18:00:00Z",
    "total_entries_count": 41,
    "entry_fee_total_usd": 4100.0,
    "compliance_officer_name": "Label Submissions Director 9",
    "first_round_accepted_count": 40,
    "disqualified_entries_count": 1,
    "payment_reconciliation_hash": "PAY_HASH_88008"
  },
  {
    "batch_id": "SUB_BATCH_010",
    "ceremony_id": "CEREMONY_010",
    "submitting_label_id": "LBL_WARNER_RECORDS_10",
    "submission_timestamp": "1968-10-15T18:00:00Z",
    "total_entries_count": 43,
    "entry_fee_total_usd": 4300.0,
    "compliance_officer_name": "Label Submissions Director 10",
    "first_round_accepted_count": 42,
    "disqualified_entries_count": 1,
    "payment_reconciliation_hash": "PAY_HASH_88009"
  },
  {
    "batch_id": "SUB_BATCH_011",
    "ceremony_id": "CEREMONY_011",
    "submitting_label_id": "LBL_COLUMBIA_RECORDS_11",
    "submission_timestamp": "1969-10-15T18:00:00Z",
    "total_entries_count": 45,
    "entry_fee_total_usd": 4500.0,
    "compliance_officer_name": "Label Submissions Director 11",
    "first_round_accepted_count": 44,
    "disqualified_entries_count": 1,
    "payment_reconciliation_hash": "PAY_HASH_88010"
  },
  {
    "batch_id": "SUB_BATCH_012",
    "ceremony_id": "CEREMONY_012",
    "submitting_label_id": "LBL_RCA_VICTOR_12",
    "submission_timestamp": "1970-10-15T18:00:00Z",
    "total_entries_count": 47,
    "entry_fee_total_usd": 4700.0,
    "compliance_officer_name": "Label Submissions Director 12",
    "first_round_accepted_count": 46,
    "disqualified_entries_count": 1,
    "payment_reconciliation_hash": "PAY_HASH_88011"
  },
  {
    "batch_id": "SUB_BATCH_013",
    "ceremony_id": "CEREMONY_013",
    "submitting_label_id": "LBL_ATLANTIC_RECORDS_13",
    "submission_timestamp": "1971-10-15T18:00:00Z",
    "total_entries_count": 49,
    "entry_fee_total_usd": 4900.0,
    "compliance_officer_name": "Label Submissions Director 13",
    "first_round_accepted_count": 48,
    "disqualified_entries_count": 1,
    "payment_reconciliation_hash": "PAY_HASH_88012"
  },
  {
    "batch_id": "SUB_BATCH_014",
    "ceremony_id": "CEREMONY_014",
    "submitting_label_id": "LBL_MOTOWN_RECORDS_14",
    "submission_timestamp": "1972-10-15T18:00:00Z",
    "total_entries_count": 51,
    "entry_fee_total_usd": 5100.0,
    "compliance_officer_name": "Label Submissions Director 14",
    "first_round_accepted_count": 50,
    "disqualified_entries_count": 1,
    "payment_reconciliation_hash": "PAY_HASH_88013"
  },
  {
    "batch_id": "SUB_BATCH_015",
    "ceremony_id": "CEREMONY_015",
    "submitting_label_id": "LBL_CAPITOL_RECORDS_15",
    "submission_timestamp": "1973-10-15T18:00:00Z",
    "total_entries_count": 53,
    "entry_fee_total_usd": 5300.0,
    "compliance_officer_name": "Label Submissions Director 15",
    "first_round_accepted_count": 52,
    "disqualified_entries_count": 1,
    "payment_reconciliation_hash": "PAY_HASH_88014"
  },
  {
    "batch_id": "SUB_BATCH_016",
    "ceremony_id": "CEREMONY_016",
    "submitting_label_id": "LBL_EPIC_RECORDS_16",
    "submission_timestamp": "1974-10-15T18:00:00Z",
    "total_entries_count": 55,
    "entry_fee_total_usd": 5500.0,
    "compliance_officer_name": "Label Submissions Director 16",
    "first_round_accepted_count": 54,
    "disqualified_entries_count": 1,
    "payment_reconciliation_hash": "PAY_HASH_88015"
  },
  {
    "batch_id": "SUB_BATCH_017",
    "ceremony_id": "CEREMONY_017",
    "submitting_label_id": "LBL_INTERSCOPE_RECORDS_17",
    "submission_timestamp": "1975-10-15T18:00:00Z",
    "total_entries_count": 57,
    "entry_fee_total_usd": 5700.0,
    "compliance_officer_name": "Label Submissions Director 17",
    "first_round_accepted_count": 56,
    "disqualified_entries_count": 1,
    "payment_reconciliation_hash": "PAY_HASH_88016"
  },
  {
    "batch_id": "SUB_BATCH_018",
    "ceremony_id": "CEREMONY_018",
    "submitting_label_id": "LBL_DEF_JAM_RECORDINGS_18",
    "submission_timestamp": "1976-10-15T18:00:00Z",
    "total_entries_count": 59,
    "entry_fee_total_usd": 5900.0,
    "compliance_officer_name": "Label Submissions Director 18",
    "first_round_accepted_count": 58,
    "disqualified_entries_count": 1,
    "payment_reconciliation_hash": "PAY_HASH_88017"
  },
  {
    "batch_id": "SUB_BATCH_019",
    "ceremony_id": "CEREMONY_019",
    "submitting_label_id": "LBL_BLUE_NOTE_RECORDS_19",
    "submission_timestamp": "1977-10-15T18:00:00Z",
    "total_entries_count": 61,
    "entry_fee_total_usd": 6100.0,
    "compliance_officer_name": "Label Submissions Director 19",
    "first_round_accepted_count": 60,
    "disqualified_entries_count": 1,
    "payment_reconciliation_hash": "PAY_HASH_88018"
  },
  {
    "batch_id": "SUB_BATCH_020",
    "ceremony_id": "CEREMONY_020",
    "submitting_label_id": "LBL_WARNER_RECORDS_20",
    "submission_timestamp": "1978-10-15T18:00:00Z",
    "total_entries_count": 63,
    "entry_fee_total_usd": 6300.0,
    "compliance_officer_name": "Label Submissions Director 20",
    "first_round_accepted_count": 62,
    "disqualified_entries_count": 1,
    "payment_reconciliation_hash": "PAY_HASH_88019"
  },
  {
    "batch_id": "SUB_BATCH_021",
    "ceremony_id": "CEREMONY_021",
    "submitting_label_id": "LBL_COLUMBIA_RECORDS_21",
    "submission_timestamp": "1979-10-15T18:00:00Z",
    "total_entries_count": 65,
    "entry_fee_total_usd": 6500.0,
    "compliance_officer_name": "Label Submissions Director 21",
    "first_round_accepted_count": 64,
    "disqualified_entries_count": 1,
    "payment_reconciliation_hash": "PAY_HASH_88020"
  },
  {
    "batch_id": "SUB_BATCH_022",
    "ceremony_id": "CEREMONY_022",
    "submitting_label_id": "LBL_RCA_VICTOR_22",
    "submission_timestamp": "1980-10-15T18:00:00Z",
    "total_entries_count": 67,
    "entry_fee_total_usd": 6700.0,
    "compliance_officer_name": "Label Submissions Director 22",
    "first_round_accepted_count": 66,
    "disqualified_entries_count": 1,
    "payment_reconciliation_hash": "PAY_HASH_88021"
  },
  {
    "batch_id": "SUB_BATCH_023",
    "ceremony_id": "CEREMONY_023",
    "submitting_label_id": "LBL_ATLANTIC_RECORDS_23",
    "submission_timestamp": "1981-10-15T18:00:00Z",
    "total_entries_count": 69,
    "entry_fee_total_usd": 6900.0,
    "compliance_officer_name": "Label Submissions Director 23",
    "first_round_accepted_count": 68,